{"$schema":"https://json-schema.org/draft/2020-12/schema","$id":"https://telemetryiq.local/schemas/model-interaction/0.1.0","title":"TelemetryIQ model interaction record","type":"object","additionalProperties":false,"required":["schema_version","request_id","session_id","provider","tool","model","started_at","completed_at","duration_ms","input_tokens","output_tokens","cached_input_tokens","reasoning_tokens","result","error_code","provenance","provider_extensions"],"properties":{"schema_version":{"const":"0.1.0"},"request_id":{"type":"string","minLength":1},"session_id":{"type":"string","minLength":1},"provider":{"type":"string","minLength":1},"tool":{"type":"string","minLength":1},"model":{"type":"string","minLength":1},"started_at":{"type":"string","format":"date-time"},"completed_at":{"type":"string","format":"date-time"},"duration_ms":{"type":["integer","null"],"minimum":0},"input_tokens":{"type":["integer","null"],"minimum":0},"output_tokens":{"type":["integer","null"],"minimum":0},"cached_input_tokens":{"type":["integer","null"],"minimum":0},"reasoning_tokens":{"type":["integer","null"],"minimum":0},"result":{"type":"string","minLength":1},"error_code":{"type":["string","null"]},"provenance":{"enum":["observed","inferred","unknown"]},"provider_extensions":{"type":"object"}}}
