[
  {
    "schema_version": "0.1.0",
    "request_id": "codex-log:595ab078aefb08cba919bd7adfcf462c436fb05996a87d52efa2149553227817",
    "session_id": "codex:synthetic-codex-conversation",
    "provider": "openai",
    "tool": "codex",
    "model": "synthetic-model",
    "started_at": "2026-07-28T12:00:00Z",
    "completed_at": "2026-07-28T12:00:00Z",
    "duration_ms": null,
    "input_tokens": 100,
    "output_tokens": 10,
    "cached_input_tokens": null,
    "reasoning_tokens": null,
    "result": "unknown",
    "error_code": null,
    "provenance": "observed",
    "provider_extensions": {
      "correlation": {
        "dedup_key": "codex-log:595ab078aefb08cba919bd7adfcf462c436fb05996a87d52efa2149553227817",
        "ordering_key": "01785240000000000000:codex-log:595ab078aefb08cba919bd7adfcf462c436fb05996a87d52efa2149553227817",
        "task_boundary": {
          "confidence": "unknown",
          "reason": "Codex log telemetry has no reviewed task-boundary signal"
        }
      },
      "log_attributes": {
        "conversation.id": "synthetic-codex-conversation",
        "event.name": "codex.sse_event",
        "input_token_count": "100",
        "model": "synthetic-model",
        "output_token_count": "10"
      },
      "log_record": {
        "severity_text": "INFO"
      },
      "resource_attributes": {
        "env": "telemetryiq-synthetic",
        "service.name": "codex_exec",
        "service.version": "0.145.0",
        "telemetry.sdk.version": "synthetic-0.31.0"
      },
      "severity": "INFO"
    }
  }
]
