[
  {
    "schema_version": "0.1.0",
    "request_id": "cursor-agent:fixture",
    "session_id": "cursor-agent:fixture",
    "provider": "cursor",
    "tool": "cursor-agent",
    "model": "unknown",
    "started_at": "2026-08-31T13:41:51.103Z",
    "completed_at": "2026-08-31T13:42:00Z",
    "duration_ms": 8897,
    "input_tokens": 16941,
    "output_tokens": 1,
    "cached_input_tokens": 0,
    "reasoning_tokens": null,
    "result": "success",
    "error_code": null,
    "provenance": "unknown",
    "provider_extensions": {
      "cache_write_tokens": 0,
      "correlation": {
        "dedup_key": "cursor-agent:fixture",
        "ordering_key": "01788183711103000000:cursor-agent:fixture",
        "task_boundary": {
          "confidence": "unknown",
          "reason": "Cursor Agent fixtures have no reviewed task-boundary signal"
        }
      },
      "outcome_contract": {
        "confidence": "observed",
        "duration_ms": 8897,
        "input_tokens": 16941,
        "output_tokens": 1,
        "source": "provider_completion",
        "status": "success"
      },
      "result": {},
      "source_type": "local_cli_print_json",
      "timestamps": {
        "completed_at": "captured_at",
        "started_at": "derived_from_duration"
      }
    }
  }
]
