{"schema_version":"0.1.0","request_id":"req-001","session_id":"session-001","provider":"openai","tool":"codex","model":"gpt-5-codex","started_at":"2026-07-24T12:00:00Z","completed_at":"2026-07-24T12:00:02Z","duration_ms":2000,"input_tokens":9000,"output_tokens":1200,"cached_input_tokens":5000,"reasoning_tokens":null,"result":"success","error_code":"","provenance":"observed","provider_extensions":{"mcp_call":{"server":"filesystem","method":"read_file"},"skill":{"name":"pdf"},"file_operation":{"path":"/tmp/report.md","bytes":2048}}}
